### ISSUE TITLE
how to capture vxlan traffic ?

### ISSUE THREAD

**Issue by todaygood** [the-tcpdump-group/tcpdump#611]
Hi Guys,

how to capture vxlan traffic ? 
If "tcpdump port 4789 "  , I found only capture received packets not sent  packets.  
If "tcpdump "  ,  I found  bidirectional packets,  you can check the attachement file a.cap. 

[root@cloud-sz-compute  ~]# tcpdump -i bond0 -enn port 4789 
tcpdump: WARNING: bond0: no IPv4 address assigned
tcpdump: verbose output suppressed, use -v or -vv for full protocol decode
listening on bond0, link-type EN10MB (Ethernet), capture size 65535 bytes
17:29:33.822060 24:8a:07:55:44:6c > 70:79:90:59:e6:66, ethertype 802.1Q (0x8100), length 216: vlan 32, p 0, ethertype IPv4, 10.53.32.14.41976 > 10.53.32.18.4789: VXLAN, flags [I] (0x08), vni 72
fa:16:3e:49:cc:ed > fa:16:3e:c7:1d:6c, ethertype IPv4 (0x0800), length 162: 10.56.1.1 > 10.56.1.9: ICMP echo reply, id 2325, seq 2290, length 128
17:29:33.822411 24:8a:07:55:41:8c > 70:79:90:59:e6:66, ethertype 802.1Q (0x8100), length 120: vlan 32, p 0, ethertype IPv4, 10.53.32.13.51186 > 10.53.32.18.4789: VXLAN, flags [I] (0x08), vni 72
fa:16:3e:82:dd:78 > fa:16:3e:c7:1d:6c, ethertype IPv4 (0x0800), length 66: 10.56.1.2.33536 > 10.56.1.9.22: Flags [.], ack 1345847981, win 1963, options [nop,nop,TS val 87064095 ecr 18242726], length 0
17:29:33.831974 24:8a:07:55:41:8c > 70:79:90:59:e6:66, ethertype 802.1Q (0x8100), length 96: vlan 32, p 0, ethertype IPv4, 10.53.32.13.54351 > 10.53.32.18.4789: VXLAN, flags [I] (0x08), vni 72
fa:16:3e:82:dd:78 > fa:16:3e:c7:1d:6c, ethertype ARP (0x0806), length 42: Reply 10.56.1.2 is-at fa:16:3e:82:dd:78, length 28
17:29:34.822035 24:8a:07:55:44:6c > 70:79:90:59:e6:66, ethertype 802.1Q (0x8100), length 216: vlan 32, p 0, ethertype IPv4, 10.53.32.14.41976 > 10.53.32.18.4789: VXLAN, flags [I] (0x08), vni 72
fa:16:3e:49:cc:ed > fa:16:3e:c7:1d:6c, ethertype IPv4 (0x0800), length 162: 10.56.1.1 > 10.56.1.9: ICMP echo reply, id 2325, seq 2291, length 128
17:29:34.822559 24:8a:07:55:41:8c > 70:79:90:59:e6:66, ethertype 802.1Q (0x8100), length 120: vlan 32, p 0, ethertype IPv4, 10.53.32.13.51186 > 10.53.32.18.4789: VXLAN, flags [I] (0x08), vni 72
fa:16:3e:82:dd:78 > fa:16:3e:c7:1d:6c, ethertype IPv4 (0x0800), length 66: 10.56.1.2.33536 > 10.56.1.9.22: Flags [.], ack 101, win 1963, options [nop,nop,TS val 87065095 ecr 18243726], length 0

[root@cloud-sz-compute  ~]# tcpdump -i bond0 -enn | grep -C 3 ICMP 
17:08:59.836509 80:d4:a5:29:a1:11 > 24:8a:07:55:41:90, ethertype 802.1Q (0x8100), length 152: vlan 32, p 0, ethertype IPv4, 10.53.32.22.50915 > 10.53.32.12.4789: VXLAN, flags [I] (0x08), vni 22
fa:16:3e:e3:c1:25 > fa:16:3e:ca:5f:ad, ethertype IPv4 (0x0800), length 98: 10.56.1.5 > 10.56.1.1: ICMP echo request, id 9589, seq 31, length 64
17:08:59.836624 24:8a:07:55:41:90 > 80:d4:a5:29:a1:11, ethertype 802.1Q (0x8100), length 152: vlan 32, p 0, ethertype IPv4, 10.53.32.12.44805 > 10.53.32.22.4789: VXLAN, flags [I] (0x08), vni 22
fa:16:3e:ca:5f:ad > fa:16:3e:e3:c1:25, ethertype IPv4 (0x0800), length 98: 10.56.1.1 > 10.56.1.5: ICMP echo reply, id 9589, seq 31, length 64

**Comment by todaygood** [comment]
[a.zip](https://github.com/the-tcpdump-group/tcpdump/files/1127393/a.zip)

**Comment by guyharris** [comment]
What version of libpcap is this using?  (What does `tcpdump -h` print?)

**Comment by todaygood** [comment]
tcpdump version 4.5.1
libpcap version 1.5.3

**Comment by guyharris** [comment]
What happens if you download the latest libpcap and tcpdump source from www.tcpdump.org, build libpcap, build tcpdump (make sure you extract the libpcap and tcpdump source into subdirectories of the same directory, so that tcpdump will be built with that version of libpcap), and try that?

**Comment by todaygood** [comment]
I apply the latest version , found the issue still exists. 

[root@cloud  tcpdump-4.9.0]# ./tcpdump -i bond0 -enn  |  grep -C 3 ICMP
tcpdump: verbose output suppressed, use -v or -vv for full protocol decode
listening on bond0, link-type EN10MB (Ethernet), capture size 262144 bytes
21:30:13.515306 24:8a:07:55:44:6c > 24:8a:07:55:41:8c, ethertype 802.1Q (0x8100), length 441: vlan 16, p 0, ethertype IPv4, 10.53.16.14.25672 > 10.53.16.13.48760: Flags [P.], seq 13554:13925, ack 1, win 1432, options [nop,nop,TS val 280603829 ecr 101503762], length 371
21:30:13.515358 24:8a:07:55:41:8c > 24:8a:07:55:44:6c, ethertype 802.1Q (0x8100), length 70: vlan 16, p 0, ethertype IPv4, 10.53.16.13.48760 > 10.53.16.14.25672: Flags [.], ack 13925, win 3034, options [nop,nop,TS val 101503791 ecr 280603829], length 0
21:30:13.521574 70:79:90:59:e6:66 > 24:8a:07:55:44:6c, ethertype 802.1Q (0x8100), length 216: vlan 32, p 0, ethertype IPv4, 10.53.32.18.54198 > 10.53.32.14.4789: VXLAN, flags [I] (0x08), vni 72
fa:16:3e:c7:1d:6c > fa:16:3e:49:cc:ed, ethertype IPv4 (0x0800), length 162: 10.56.1.9 > 10.56.1.1: ICMP echo request, id 2435, seq 107, length 128
21:30:13.521617 24:8a:07:55:44:6c > 70:79:90:59:e6:66, ethertype 802.1Q (0x8100), length 216: vlan 32, p 0, ethertype IPv4, 10.53.32.14.41976 > 10.53.32.18.4789: VXLAN, flags [I] (0x08), vni 72
fa:16:3e:49:cc:ed > fa:16:3e:c7:1d:6c, ethertype IPv4 (0x0800), length 162: 10.56.1.1 > 10.56.1.9: ICMP echo reply, id 2435, seq 107, length 128
21:30:13.524088 24:8a:07:55:44:6c > 24:8a:07:55:41:8c, ethertype 802.1Q (0x8100), length 70: vlan 16, p 0, ethertype IPv4, 10.53.16.14.57236 > 10.53.16.13.3306: Flags [.], ack 157, win 229, options [nop,nop,TS val 280603838 ecr 101503761], length 0
21:30:13.526269 24:8a:07:55:44:6c > 24:8a:07:55:41:8c, ethertype 802.1Q (0x8100), length 1453: vlan 16, p 0, ethertype IPv4, 10.53.16.14.25672 > 10.53.16.13.48760: Flags [P.], seq 13925:15308, ack 1, win 1432, options [nop,nop,TS val 280603840 ecr 101503791], length 1383

[root@cloud tcpdump-4.9.0]# ./tcpdump -i bond0 -enn vlan 32 (or  port 4789)
tcpdump: verbose output suppressed, use -v or -vv for full protocol decode
listening on bond0, link-type EN10MB (Ethernet), capture size 262144 bytes
21:30:42.521821 70:79:90:59:e6:66 > 24:8a:07:55:44:6c, ethertype 802.1Q (0x8100), length 216: vlan 32, p 0, ethertype IPv4, 10.53.32.18.54198 > 10.53.32.14.4789: VXLAN, flags [I] (0x08), vni 72
fa:16:3e:c7:1d:6c > fa:16:3e:49:cc:ed, ethertype IPv4 (0x0800), length 162: 10.56.1.9 > 10.56.1.1: ICMP echo request, id 2435, seq 136, length 128
21:30:42.525573 70:79:90:59:e6:66 > 24:8a:07:55:44:6c, ethertype 802.1Q (0x8100), length 60: vlan 32, p 0, ethertype ARP, Request who-has 10.53.32.14 tell 10.53.32.18, length 42
21:30:42.525583 24:8a:07:55:44:6c > 70:79:90:59:e6:66, ethertype 802.1Q (0x8100), length 46: vlan 32, p 0, ethertype ARP, Reply 10.53.32.14 is-at 24:8a:07:55:44:6c, length 28
21:30:43.521927 70:79:90:59:e6:66 > 24:8a:07:55:44:6c, ethertype 802.1Q (0x8100), length 216: vlan 32, p 0, ethertype IPv4, 10.53.32.18.54198 > 10.53.32.14.4789: VXLAN, flags [I] (0x08), vni 72
fa:16:3e:c7:1d:6c > fa:16:3e:49:cc:ed, ethertype IPv4 (0x0800), length 162: 10.56.1.9 > 10.56.1.1: ICMP echo request, id 2435, seq 137, length 128

[root@cloud  tcpdump-4.9.0]# ./tcpdump -h 
tcpdump version 4.9.0
libpcap version 1.8.1

**Comment by mcr** [comment]
17:29:33.822060 24:8a:07:55:44:6c > 70:79:90:59:e6:66, ethertype
                802.1Q (0x8100), length 216: vlan 32, p 0, ethertype IPv4,
                10.53.32.14.41976 > 10.53.32.18.4789: VXLAN, flags [I] (0x08), vni 72
                fa:16:3e:49:cc:ed > fa:16:3e:c7:1d:6c,
                ethertype IPv4 (0x0800), length
                162: 10.56.1.1 > 10.56.1.9: ICMP echo reply, id 2325, seq
...
   10.56.1.1 > 10.56.1.9: ICMP echo reply, id 2325, seq 2291, length
   10.56.1.5 > 10.56.1.1: ICMP echo request, id 9589, seq 31, length

it looks like there are bidirectional packets in the capture to me?
Can you give us an example of traffic that is missing?

--
]               Never tell me the odds!                 | ipv6 mesh networks [
]   Michael Richardson, Sandelman Software Works        | network architect  [
]     mcr@sandelman.ca  http://www.sandelman.ca/        |   ruby on rails    [

**Comment by todaygood** [comment]
why my two commands
"tcpdump -i bond0 -enn | grep -C 3 ICMP"
and
"tcpdump -i bond0 -enn vlan 32 (or port 4789)"
make me see different result about   ICMP traffic  between  10.56.1.9 and 10.56.1.1  ?

**Comment by links84** [comment]
'-T vxlan' also help, just that i cant find a way to enforce a vni id.

**Comment by zhangmroy** [comment]
so  how can i  filter the vni , can anybody do me a flavor~?

**Comment by kandsten** [comment]
@zhangmroy 
`tcpdump -l -n -i <if> 'port 4789 and udp[8:2] = 0x0800 & 0x0800 and udp[11:4] = <vni> & 0x00FFFFFF'`

**Comment by zhangmroy** [comment]
@kandsten thnaks a lot,

**Comment by zhangmroy** [comment]
@kandsten thanks a lot
