### ISSUE TITLE
tcpdump Display "(oui Unknown), ethertype Unknown"

### ISSUE THREAD

**Issue by Devinchai** [the-tcpdump-group/tcpdump#756]
I use tcpdump -i usb0(LTE module), display the following log. what does ethertype Unknown mean? Is this an anomaly? thank you!

    21:48:46.752843 ARP, Request who-has 10.8.4.110 tell 10.8.6.191, length 28
    21:48:46.754809 ARP, Reply 10.8.4.110 is-at 02:50:f3:00:0b:00 (oui Unknown), length 28
    21:49:33.013298 00:00:e9:06:5f:88 (oui Unknown) > 45:00:00:28:ab:82 (oui Unknown), ethertype Unknown (0xb9e8), length 40: 
    	0x0000:  1e43 85a3 68f6 ce05 13ba e6e4 d0ce 0000  .C..h...........
    	0x0010:  0000 5002 0400 4baa 0000                 ..P...K...
    21:49:42.285323 IP 10.8.6.191 > 10.8.4.110: ESP(spi=0x5ab5478d,seq=0x2), length 132
    21:49:42.392632 00:00:f9:32:4f:68 (oui Unknown) > 45:00:00:98:00:02 (oui Unknown), ethertype Unknown (0xafb3), length 152: 
    	0x0000:  d37c 85a3 68f6 c902 f090 0000 0002 6598  .|..h.........e.
    	0x0010:  21e7 8a76 6fcb 5db6 3be6 1f65 f81c c2a2  !..vo.].;..e....
    	0x0020:  0ebd ba98 a7d4 2560 c297 db3d b9db 909b  ......%`...=....
    	0x0030:  2c36 67f9 32bc b777 3480 07e0 33f5 6737  ,6g.2..w4...3.g7
    	0x0040:  6eb7 12bf d740 0523 239f b6d8 12cf f01c  n....@.##.......
    	0x0050:  a3a3 bcac 089b 2739 6e21 7b34 6b58 5b86  ......'9n!{4kX[.
    	0x0060:  152e 6746 f43c 6c6b ce2c 78c6 45cb 6a98  ..gF.<lk.,x.E.j.
    	0x0070:  3285 93ab c393 12ac 4653 579f f16f 98ae  2.......FSW..o..
    	0x0080:  1a84 a460 13b0 5fcf d54f                 ...`.._..O
    21:49:44.369552 IP 10.8.6.191> 10.8.4.110: ESP(spi=0x5ab5478d,seq=0x3), length 132
    21:49:44.470694 00:00:f9:32:4f:67 (oui Unknown) > 45:00:00:98:00:03 (oui Unknown), ethertype Unknown (0xafb3), length 152: 
    	0x0000:  d37c 85a3 68f6 c902 f090 0000 0003 85a5  .|..h...........
    	0x0010:  cf94 dec2 b628 2db4 b416 4ef8 330f 44ed  .....(-...N.3.D.
    	0x0020:  8206 aa1d 601d 3e5b 289d 9aa5 f2ab e0c9  ....`.>[(.......
    	0x0030:  cf72 b30d ec92 5fb5 dbcc e115 7cb9 4bde  .r...._.....|.K.
    	0x0040:  444b 11f8 d452 4ac0 3f6a 1ceb 9603 17d3  DK...RJ.?j......
    	0x0050:  c9f9 5ed7 2063 e9d7 5456 359d 6e3a b8d6  ..^..c..TV5.n:..
    	0x0060:  2060 753b dfbe ad0f df84 4185 25a8 40c5  .`u;......A.%.@.
    	0x0070:  930d f1d2 ba11 9330 5bfd 7c78 34f1 bb90  .......0[.|x4...
    	0x0080:  ac19 ff21 60d1 7334 0460                 ...!`.s4.`

**Comment by guyharris** [comment]
It means that, if the raw packet data that the kernel handed to libpcap is interpreted as being data for an Ethernet packet, the Ethernet type/length field has a value that 1) isn't a length value (because it's bigger than 1514) and 2) isn't an Ethernet type value that tcpdump knows.

This could either mean 1) it's some special private protocol or 2) the kernel is handing weird data to libpcap.

*Some* of the packets are being printed normally, so either 1) it's some special private protocol or 2) the kernel is handing weird data to libpcap for some, but not all, packets.

The fact that the destination address begins with 45 makes me a *little* suspicious that the kernel might be handing raw IP packets, with no link-layer header, to libpcap.  The first packet would be:

    45 00 00 28 ab 82 00 00 e9 06 5f 88 b9 e8 1e 43
    85 a3 68 f6 ce 05 13 ba e6 e4 d0 ce 00 00 00 00
    50 02 04 00 4b aa 00 00

which, if interpreted as an IPv4 packet, would be:

- 0x45 - version 4, header length 5 4-byte words or 20 bytes (standard IPv4 header size with no options)
- 0x00 - type of service
- 0x00 0x28 - total length, 40 bytes
- 0xab 0x82 - identification
- 0x00 0x00 - flags and fragment offset; the fragment offset is 0, and the MF flag isn't set, so it's not fragmented
- 0xe9 - time to live, 233 hops
- 0x06 - protocol, 6 = TCP
- 0x5f 0x88 - checksum, 0x5f88, I'm too lazy to check it
- 0xb9 0xe8 0x1e 0x43 -  source IP address, 185.232.30.67
- 0x85 0xa3 0x68 0xf6 - destination IP address, 133.163.104.246
- 0xce 0x05 - source TCP port, 52741
- 0x13 0xba - destination TCP port, 5050
- 0xe6 0xe4 0xd0 0xce - sequence number
- 0x00 0x00 0x00 0x00 - acknowledgement number
- 0x50 - data offset, 5 4-byte words or 20 bytes (standard TCP header size with no options)
- 0x02 - flags, only SYN is set, so this would be an initial SYN
- 0x04 0x00 - window, 1024 bytes
- 0x4b 0xaa - TCP checksum, 0x4baa, I'm too lazy to check it
- 0x00 0x00 - urgent pointer

so my guess is that Linux is sometimes supplying (fake) Ethernet packets and sometimes supplying raw IP packets.

I'll see if I can find anything in the kernel to indicate that this might be happening, and to find out how libpcap can determine whether the device is that type of hostile device and work around its brokenness by punting to "cooked mode" (which libpcap already does for other devices with non-helpful kernel code of that sort).

**Comment by guyharris** [comment]
What particular type of LTE modem is this (vendor and model name/number)?  Do you know what the Linux driver is for it?

**Comment by Devinchai** [comment]
LTE is qualcomm's mdm9225m, it use qualcomm gobi driver.

**Comment by Devinchai** [comment]
it may be ESP data(No encryption)?

**Comment by guyharris** [comment]
> it may be ESP data(No encryption)?

At least one ESP packet appears to have an Ethernet header, as tcpdump printed it normally, so I suspect it's not that simple.

**Comment by mcr** [comment]
Guy Harris <notifications@github.com> wrote:
    > it may be ESP data(No encryption)?

    > At least one ESP packet appears to have an Ethernet header, as tcpdump
    > printed it normally, so I suspect it's not that simple.

The linux kernel runs ESP packets through the capture point twice with
different encapsulation.  The first time with just IP encapsulation.
It's a long-standing bug.

**Comment by guyharris** [comment]
So this is just Linux kernel breakage, causing the same packet to appear twice on a `PF_PACKET` socket, and with one instance having its link-layer headers stripped off even if it's `SOCK_RAW`?

**Comment by Devinchai** [comment]
@mcr   
    I only posted part packet above, including a lot of normal ESP data in log. when  switching from 3G to LTE at this moment, display "unkown" packet. Is the packets corrupted?

.......
.......
21:46:40.762856 IP 133.163.104.246 > 175.179.211.124: ESP(spi=0x8cda1266,seq=0x3b), length 132
21:46:41.200207 IP 175.179.211.124 > 133.163.104.246: ESP(spi=0xc67be8f6,seq=0x3b), length 132
21:46:41.200428 IP 172.16.255.254 > 172.21.124.193: ICMP echo reply, id 48919, seq 0, length 64
21:46:43.870152 IP 185.232.30.67.52741 > 133.163.104.246.3397: Flags [S], seq 2361194374, win 1024, length 0
21:46:45.772910 ARP, Request who-has 175.179.211.124 tell 133.163.104.246, length 28
21:46:45.774973 ARP, Reply 175.179.211.124 is-at 02:50:f3:00:0b:00 (oui Unknown), length 28
21:47:41.262629 IP 133.163.104.246 > 175.179.211.124: ESP(spi=0x8cda1266,seq=0x3c), length 132
21:47:41.690086 IP 175.179.211.124 > 133.163.104.246: ESP(spi=0xc67be8f6,seq=0x3c), length 132
21:47:41.690303 IP 172.16.255.254 > 172.21.124.193: ICMP echo reply, id 54828, seq 0, length 64
21:47:44.940061 IP 175.179.211.124.isakmp > 133.163.104.246.isakmp: isakmp: phase 2/others ? oakley-quick[E]
21:47:45.462056 IP 133.163.104.246.isakmp > 175.179.211.124.isakmp: isakmp: phase 2/others ? oakley-quick[E]
21:47:46.262818 ARP, Request who-has 175.179.211.124 tell 133.163.104.246, length 28
21:47:46.264885 ARP, Reply 175.179.211.124 is-at 02:50:f3:00:0b:00 (oui Unknown), length 28
21:47:46.449907 IP 175.179.211.124.isakmp > 133.163.104.246.isakmp: isakmp: phase 2/others ? oakley-quick[E]
21:47:57.490018 IP 58.218.66.81.42301 > 133.163.104.246.1433: Flags [S], seq 2755461120, win 16384, length 0
21:48:24.500061 IP 181.211.244.134.47283 > 133.163.104.246.8080: Flags [S], seq 1162030873, win 14600, length 0
21:48:41.752291 IP 133.163.104.246 > 175.179.211.124: ESP(spi=0x5ab5478d,seq=0x1), length 132
21:48:42.220130 IP 175.179.211.124 > 133.163.104.246: ESP(spi=0xc902f090,seq=0x1), length 132
21:48:42.220400 IP 172.16.255.254 > 172.21.124.193: ICMP echo reply, id 53569, seq 0, length 64
21:48:45.069920 IP 175.179.211.124.isakmp > 133.163.104.246.isakmp: isakmp: phase 2/others ? inf[E]
21:48:46.752843 ARP, Request who-has 175.179.211.124 tell 133.163.104.246, length 28
21:48:46.754809 ARP, Reply 175.179.211.124 is-at 02:50:f3:00:0b:00 (oui Unknown), length 28
21:49:33.013298 00:00:e9:06:5f:88 (oui Unknown) > 45:00:00:28:ab:82 (oui Unknown), ethertype Unknown (0xb9e8), length 40: 
	0x0000:  1e43 85a3 68f6 ce05 13ba e6e4 d0ce 0000  .C..h...........
	0x0010:  0000 5002 0400 4baa 0000                 ..P...K...
21:49:42.285323 IP 133.163.104.246 > 175.179.211.124: ESP(spi=0x5ab5478d,seq=0x2), length 132
21:49:42.392632 00:00:f9:32:4f:68 (oui Unknown) > 45:00:00:98:00:02 (oui Unknown), ethertype Unknown (0xafb3), length 152: 
	0x0000:  d37c 85a3 68f6 c902 f090 0000 0002 6598  .|..h.........e.
	0x0010:  21e7 8a76 6fcb 5db6 3be6 1f65 f81c c2a2  !..vo.].;..e....
	0x0020:  0ebd ba98 a7d4 2560 c297 db3d b9db 909b  ......%`...=....
	0x0030:  2c36 67f9 32bc b777 3480 07e0 33f5 6737  ,6g.2..w4...3.g7
	0x0040:  6eb7 12bf d740 0523 239f b6d8 12cf f01c  n....@.##.......
	0x0050:  a3a3 bcac 089b 2739 6e21 7b34 6b58 5b86  ......'9n!{4kX[.
	0x0060:  152e 6746 f43c 6c6b ce2c 78c6 45cb 6a98  ..gF.<lk.,x.E.j.
	0x0070:  3285 93ab c393 12ac 4653 579f f16f 98ae  2.......FSW..o..
	0x0080:  1a84 a460 13b0 5fcf d54f                 ...`.._..O
21:49:44.369552 IP 133.163.104.246 > 175.179.211.124: ESP(spi=0x5ab5478d,seq=0x3), length 132
21:49:44.470694 00:00:f9:32:4f:67 (oui Unknown) > 45:00:00:98:00:03 (oui Unknown), ethertype Unknown (0xafb3), length 152: 
	0x0000:  d37c 85a3 68f6 c902 f090 0000 0003 85a5  .|..h...........
	0x0010:  cf94 dec2 b628 2db4 b416 4ef8 330f 44ed  .....(-...N.3.D.
	0x0020:  8206 aa1d 601d 3e5b 289d 9aa5 f2ab e0c9  ....`.>[(.......
	0x0030:  cf72 b30d ec92 5fb5 dbcc e115 7cb9 4bde  .r...._.....|.K.
	0x0040:  444b 11f8 d452 4ac0 3f6a 1ceb 9603 17d3  DK...RJ.?j......
	0x0050:  c9f9 5ed7 2063 e9d7 5456 359d 6e3a b8d6  ..^..c..TV5.n:..
	0x0060:  2060 753b dfbe ad0f df84 4185 25a8 40c5  .`u;......A.%.@.
	0x0070:  930d f1d2 ba11 9330 5bfd 7c78 34f1 bb90  .......0[.|x4...
	0x0080:  ac19 ff21 60d1 7334 0460                 ...!`.s4.` 
......
......

**Comment by Devinchai** [comment]
@guyharris 

21:49:42.285323 IP 133.163.104.246 > 175.179.211.124: ESP(spi=0x5ab5478d,seq=0x2), length 132
21:49:42.392632 00:00:f9:32:4f:68 (oui Unknown) > 45:00:00:98:00:02 (oui Unknown), ethertype Unknown (0xafb3), length 152: 
	0x0000:  d37c 85a3 68f6 c902 f090 0000 0002 6598  .|..h.........e.
	0x0010:  21e7 8a76 6fcb 5db6 3be6 1f65 f81c c2a2  !..vo.].;..e....
 	0x0020:  0ebd ba98 a7d4 2560 c297 db3d b9db 909b  ......%`...=....
	0x0030:  2c36 67f9 32bc b777 3480 07e0 33f5 6737  ,6g.2..w4...3.g7
	0x0040:  6eb7 12bf d740 0523 239f b6d8 12cf f01c  n....@.##.......
	0x0050:  a3a3 bcac 089b 2739 6e21 7b34 6b58 5b86  ......'9n!{4kX[.
	0x0060:  152e 6746 f43c 6c6b ce2c 78c6 45cb 6a98  ..gF.<lk.,x.E.j.
	0x0070:  3285 93ab c393 12ac 4653 579f f16f 98ae  2.......FSW..o..
	0x0080:  1a84 a460 13b0 5fcf d54f                 ...`.._..O

Follow your analysis above,we see the source address and destination address of the package,
 Seems to be a reply to the previous ESP packet.But Why is tcpdump not interpreted as ESP data?
...
...
0xaf 0xb3 0xd3 0x7c  - source IP address, 175.179.211.124
0x85 0xa3 0x68 0xf6 - destination IP address, 133.163.104.246
...

**Comment by guyharris** [comment]
> But Why is tcpdump not interpreted as ESP data?

Because the kernel is *not* putting a link-layer header that corresponds to the link-layer type that the kernel claims that the device has on those packets, so tcpdump has no clue that the packets have no link-layer header.  See @mcr's comment about the "a long-standing [kernel] bug".

**Comment by Devinchai** [comment]
It means is this a kernel bug? but if not switch from 3G to LTE,  No "unkown" packet  appear on a stable network;All the captured is ESP packet.

**Comment by guyharris** [comment]
> It means is this a kernel bug?

Yes.

> but if not switch from 3G to LTE, No "unkown" packet appear on a stable network;All the captured is ESP packet.

Then perhaps it's a driver bug in the kernel rather than a bug in the rest of the kernel's networking stack.

**Comment by mcr** [comment]
You'll note that the ESP packet is correctly decoded.
The kernel the decrypts the ESP packet and then has a new packet (the decrypted packet) to show the capture system.  That packet is the same packet, but now the link-layer pointers have been confused. The kernel doesn't care, it's already processed the layer-2 on the first pass.
In both captures, it's always the packet after the ESP that is confused.  The kernel should really mark the decrypted packet as not having a link-layer header if that is possible.  At this point, I insert this joke: http://www.doctorjokes.net/jokes.php?action=read&joke=254

**Comment by infrastation** [comment]
Closing as a Linux kernel bug.

**Comment by guyharris** [comment]
> At this point, I insert this joke: http://www.doctorjokes.net/jokes.php?action=read&joke=254

Dead link - try https://web.archive.org/web/20040318033143/http://doctorjokes.net/jokes.php?action=read&joke=254
