### ISSUE TITLE
Reported TCP lengths are incorrect

### ISSUE THREAD

**Issue by raybellis** [the-tcpdump-group/tcpdump#688]
Fedora Core 27 (4.15.14-300.fc27.x86_64)
tcpdump version 4.9.1
libpcap version 1.8.1
OpenSSL 1.1.0g-fips  2 Nov 2017

I noticed these bizarre length outputs when tracing some DNS over TCP traffic:

```
11:26:34.043022 IP (tos 0x0, ttl 64, id 929, offset 0, flags [DF], proto TCP (6), length 97)
    10.1.2.5.48383 > 54.165.45.170.53: Flags [P.], cksum 0x70a8 (incorrect -> 0x7aef), seq 1:46, ack 1, win 229, options [nop,nop,TS val 3794684607 ecr 3720371000], length 4531547+ [1au] SOA? uk. ar: . OPT UDPsize=4096 (43)
11:26:34.121807 IP (tos 0x0, ttl 232, id 64879, offset 0, flags [DF], proto TCP (6), length 52)
    54.165.45.170.53 > 10.1.2.5.48383: Flags [.], cksum 0x944e (correct), seq 1, ack 46, win 227, options [nop,nop,TS val 3720371079 ecr 3794684607], length 0
11:26:34.195961 IP (tos 0x0, ttl 232, id 64880, offset 0, flags [DF], proto TCP (6), length 171)
    54.165.45.170.53 > 10.1.2.5.48383: Flags [P.], cksum 0xd303 (correct), seq 1:120, ack 46, win 227, options [nop,nop,TS val 3720371153 ecr 3794684607], length 11931547$ q: SOA? uk. 1/0/1 uk. SOA dns1.nic.uk. hostmaster.nic.uk. 1403742170 7200 900 2419200 10800 ar: . OPT UDPsize=4096 (117)
```

Note the length reported in the outbound packet (4531547) and that in the response (11931547).
In other tests the two lengths always share a common decimal suffix.

I've been unable to replicate it with e.g. SSH traffic.

I've seen the same behaviour with 4.9.2.

**Comment by gvanem** [comment]
Do you have NIC checksum-offloading enabled for UDP? You're (10.1.2.5) with wrong checksums, no?

**Comment by infrastation** [comment]
The bug reproduces as described. There is a space missing between TCP length and DNS request ID in DNS-over-TCP decoding (hence the common trailer between correlated requests and responses). However, the bug fix is not just to add a space in `domain_print()` as that would result in double space in DNS-over-UDP decoding. Volunteers are welcome to produce a proper bug fix for this bug.

**Comment by raybellis** [comment]
Ah, it should have occurred to me that it was just two fields concatenated together!

**Comment by infrastation** [comment]
The next stable release will include the bug fix, thank you for the report.
