### ISSUE TITLE
Wrong ACK number of the reset TCP segment

### ISSUE THREAD

**Issue by guyharris** [the-tcpdump-group/tcpdump#128]
Converted from [SourceForge issue 3012149](http://sourceforge.net/support/tracker.php?aid=3012149), submitted by dafan

tcpdump can only print the ack number of the first reset segment correctly, and prints the wrong ack number of all of the following reset segments.

I have run tcpdump with the -X option. The ack numbers in the reset segment are all correct, but only the ack number of the first reset setment is correctly printed.

[root@Banana /home/dafan]# tcpdump -s1000 -X src or dst port 6666
tcpdump: verbose output suppressed, use -v or -vv for full protocol decode
listening on em0, link-type EN10MB (Ethernet), capture size 1000 bytes
20:19:30.256991 IP Orange.5555 > Banana.6666: Flags [S], seq 1495178259, win 65535, options [mss 1460,nop,wscale 3,sackOK,TS val 79502 ecr 0], length 0
        0x0000:  4500 003c 005d 4000 4006 dca8 ac10 02c9  E..<.]@.@.......
        0x0010:  ac10 02cd 15b3 1a0a 591e 9c13 0000 0000  ........Y.......
        0x0020:  a002 ffff 8ecf 0000 0204 05b4 0103 0303  ................
        0x0030:  0402 080a 0001 368e 0000 0000            ......6.....
20:19:30.264415 IP Banana.6666 > Orange.5555: Flags [R.], seq 0, ack 1495178260, win 0, length 0
        0x0000:  4500 0028 012c 4000 4006 dbed ac10 02cd  E..(.,@.@.......
        0x0010:  ac10 02c9 1a0a 15b3 0000 0000 591e 9c14  ............Y...
        0x0020:  5014 0000 5dd1 0000                      P...]...
20:19:48.698336 IP Orange.5555 > Banana.6666: Flags [S], seq 1504855134, win 65535, options [mss 1460,nop,wscale 3,sackOK,TS val 81347 ecr 0], length 0
        0x0000:  4500 003c 0063 4000 4006 dca2 ac10 02c9  E..<.c@.@.......
        0x0010:  ac10 02cd 15b3 1a0a 59b2 445e 0000 0000  ........Y.D^....
        0x0020:  a002 ffff debb 0000 0204 05b4 0103 0303  ................
        0x0030:  0402 080a 0001 3dc3 0000 0000            ......=.....
20:19:48.698338 IP Banana.6666 > Orange.5555: Flags [R.], seq 0, ack 9676876, win 0, length 0
        0x0000:  4500 0028 012f 4000 4006 dbea ac10 02cd  E..(./@.@.......
        0x0010:  ac10 02c9 1a0a 15b3 0000 0000 59b2 445f  ............Y.D_
        0x0020:  5014 0000 5dd1 0000                      P...]...
20:29:57.004910 IP Orange.5555 > Banana.6666: Flags [S], seq 1823712478, win 65535, options [mss 1460,nop,wscale 3,sackOK,TS val 142178 ecr 0], length 0
        0x0000:  4500 003c 0072 4000 4006 dc93 ac10 02c9  E..<.r@.@.......
        0x0010:  ac10 02cd 15b3 1a0a 6cb3 a4de 0000 0000  ........l.......
        0x0020:  a002 ffff 7d9a 0000 0204 05b4 0103 0303  ....}...........
        0x0030:  0402 080a 0002 2b62 0000 0000            ......+b....
20:29:57.027620 IP Banana.6666 > Orange.5555: Flags [R.], seq 0, ack 328534220, win 0, length 0
        0x0000:  4500 0028 0146 4000 4006 dbd3 ac10 02cd  E..(.F@.@.......
        0x0010:  ac10 02c9 1a0a 15b3 0000 0000 6cb3 a4df  ............l...
        0x0020:  5014 0000 5dd1 0000                      P...]...
