### ISSUE TITLE
How to understand the output of tcpdump?

### ISSUE THREAD

**Issue by luofeiyu** [the-tcpdump-group/tcpdump#477]
tcpdump host 192.168.1.100
tcpdump: verbose output suppressed, use -v or -vv for full protocol decode
listening on eth0, link-type EN10MB (Ethernet), capture size 262144 bytes
11:20:52.789742 IP localhost.37902 > d.root-servers.net.domain: 42429% [1au] DNSKEY? . (28)
11:20:52.789865 IP localhost.41693 > d.root-servers.net.domain: 18942% [1au] NS? . (28)
11:20:52.970349 IP d.root-servers.net.domain > localhost.37902: 42429*- 3/0/1 DNSKEY, DNSKEY, RRSIG (736)
11:20:52.977970 IP d.root-servers.net.domain > localhost.41693: 18942*- 14/0/25 NS h.root-servers.net., NS c.root-servers.net., NS f.root-servers.net., NS g.root-servers.net., NS m.root-servers.net., NS e.root-servers.net., NS k.root-servers.net., NS a.root-servers.net., NS j.root-servers.net., NS l.root-servers.net., NS d.root-servers.net., NS i.root-servers.net., NS b.root-servers.net., RRSIG (913)
11:20:53.262676 IP localhost.11242 > b.root-servers.net.domain: 20749% [1au] DNSKEY? . (28)
11:20:53.262749 IP localhost.58491 > b.root-servers.net.domain: 57315% [1au] NS? . (28)
11:20:53.670548 IP localhost.53771 > public1.alidns.com.domain: 23778+ PTR? 13.91.7.199.in-addr.arpa. (42)

1.what does d.root-servers.net.domain mean？
2.What does public1.alidns.com.domain mean？

ping public1.alidns.com
ping: unknown host public1.alidns.com

**Comment by guyharris** [comment]
> what does d.root-servers.net.domain mean？

It means that the IP address of d.root-servers.net and the port number corresponding to "domain":

    $ egrep domain /etc/services
    domain           53/udp     # Domain Name Server
    domain           53/tcp     # Domain Name Server

I.e., it means that the source IP address and port, or destination IP address and port, are the host d.root-servers.net and the UDP (or TCP) port 53.

This is not surprising, as those are DNS requests.

> What does public1.alidns.com.domain mean？

It means that the IP address of public1.alidns.com and the port number corresponding to "domain".

**Comment by infrastation** [comment]
http://computer.howstuffworks.com/dns.htm
