### ISSUE TITLE
tcpdump does not identify protocol for output packets from logical interfaces

### ISSUE THREAD

**Issue by klyngov** [the-tcpdump-group/tcpdump#658]
Using a pcap captured on a Juniper router (R1) with an lt- interface, tcpdump does filter correctly. 

```
      --> ping
   R1 --------- R2
1.1.1.1       1.1.1.2
```

Here is the full capture:

```
acunha-mbp:tmp acunha$ /usr/local/Cellar/tcpdump/4.9.2/sbin/tcpdump -r ping-lt.pcap 
reading from file ping-lt.pcap, link-type JUNIPER_ETHER (Juniper Ethernet)
15:24:09.151184 IP 1.1.1.1 > 1.1.1.2: ICMP echo request, id 22037, seq 1097, length 64
15:24:09.154246 IP 1.1.1.2 > 1.1.1.1: ICMP echo reply, id 22037, seq 1097, length 64
15:24:10.161598 IP 1.1.1.1 > 1.1.1.2: ICMP echo request, id 22037, seq 1098, length 64
15:24:10.163478 IP 1.1.1.2 > 1.1.1.1: ICMP echo reply, id 22037, seq 1098, length 64
15:24:11.172344 IP 1.1.1.1 > 1.1.1.2: ICMP echo request, id 22037, seq 1099, length 64
15:24:11.174295 IP 1.1.1.2 > 1.1.1.1: ICMP echo reply, id 22037, seq 1099, length 64
15:24:12.181590 IP 1.1.1.1 > 1.1.1.2: ICMP echo request, id 22037, seq 1100, length 64
15:24:12.183497 IP 1.1.1.2 > 1.1.1.1: ICMP echo reply, id 22037, seq 1100, length 64
15:24:13.191704 IP 1.1.1.1 > 1.1.1.2: ICMP echo request, id 22037, seq 1101, length 64
15:24:13.193169 IP 1.1.1.2 > 1.1.1.1: ICMP echo reply, id 22037, seq 1101, length 64
15:24:14.201268 IP 1.1.1.1 > 1.1.1.2: ICMP echo request, id 22037, seq 1102, length 64
15:24:14.202718 IP 1.1.1.2 > 1.1.1.1: ICMP echo reply, id 22037, seq 1102, length 64
15:24:15.211298 IP 1.1.1.1 > 1.1.1.2: ICMP echo request, id 22037, seq 1103, length 64
15:24:15.214134 IP 1.1.1.2 > 1.1.1.1: ICMP echo reply, id 22037, seq 1103, length 64
15:24:16.221979 IP 1.1.1.1 > 1.1.1.2: ICMP echo request, id 22037, seq 1104, length 64
15:24:16.224125 IP 1.1.1.2 > 1.1.1.1: ICMP echo reply, id 22037, seq 1104, length 64
15:24:17.232381 IP 1.1.1.1 > 1.1.1.2: ICMP echo request, id 22037, seq 1105, length 64
15:24:17.234406 IP 1.1.1.2 > 1.1.1.1: ICMP echo reply, id 22037, seq 1105, length 64
15:24:18.241770 IP 1.1.1.1 > 1.1.1.2: ICMP echo request, id 22037, seq 1106, length 64
15:24:18.243086 IP 1.1.1.2 > 1.1.1.1: ICMP echo reply, id 22037, seq 1106, length 64
15:24:19.251759 IP 1.1.1.1 > 1.1.1.2: ICMP echo request, id 22037, seq 1107, length 64
15:24:19.253719 IP 1.1.1.2 > 1.1.1.1: ICMP echo reply, id 22037, seq 1107, length 64
15:24:20.261232 IP 1.1.1.1 > 1.1.1.2: ICMP echo request, id 22037, seq 1108, length 64
15:24:20.262281 IP 1.1.1.2 > 1.1.1.1: ICMP echo reply, id 22037, seq 1108, length 64
15:24:21.271556 IP 1.1.1.1 > 1.1.1.2: ICMP echo request, id 22037, seq 1109, length 64
15:24:21.273209 IP 1.1.1.2 > 1.1.1.1: ICMP echo reply, id 22037, seq 1109, length 64
15:24:22.281406 IP 1.1.1.1 > 1.1.1.2: ICMP echo request, id 22037, seq 1110, length 64
15:24:22.282758 IP 1.1.1.2 > 1.1.1.1: ICMP echo reply, id 22037, seq 1110, length 64
15:24:23.291636 IP 1.1.1.1 > 1.1.1.2: ICMP echo request, id 22037, seq 1111, length 64
15:24:23.294582 IP 1.1.1.2 > 1.1.1.1: ICMP echo reply, id 22037, seq 1111, length 64
```

If I try to filter by ICMP, only INPUT/reply packets are shown: 

```


acunha-mbp:tmp acunha$ /usr/local/Cellar/tcpdump/4.9.2/sbin/tcpdump -r ping-lt.pcap icmp
reading from file ping-lt.pcap, link-type JUNIPER_ETHER (Juniper Ethernet)
15:24:09.154246 IP 1.1.1.2 > 1.1.1.1: ICMP echo reply, id 22037, seq 1097, length 64
15:24:10.163478 IP 1.1.1.2 > 1.1.1.1: ICMP echo reply, id 22037, seq 1098, length 64
15:24:11.174295 IP 1.1.1.2 > 1.1.1.1: ICMP echo reply, id 22037, seq 1099, length 64
15:24:12.183497 IP 1.1.1.2 > 1.1.1.1: ICMP echo reply, id 22037, seq 1100, length 64
15:24:13.193169 IP 1.1.1.2 > 1.1.1.1: ICMP echo reply, id 22037, seq 1101, length 64
15:24:14.202718 IP 1.1.1.2 > 1.1.1.1: ICMP echo reply, id 22037, seq 1102, length 64
15:24:15.214134 IP 1.1.1.2 > 1.1.1.1: ICMP echo reply, id 22037, seq 1103, length 64
15:24:16.224125 IP 1.1.1.2 > 1.1.1.1: ICMP echo reply, id 22037, seq 1104, length 64
15:24:17.234406 IP 1.1.1.2 > 1.1.1.1: ICMP echo reply, id 22037, seq 1105, length 64
15:24:18.243086 IP 1.1.1.2 > 1.1.1.1: ICMP echo reply, id 22037, seq 1106, length 64
15:24:19.253719 IP 1.1.1.2 > 1.1.1.1: ICMP echo reply, id 22037, seq 1107, length 64
15:24:20.262281 IP 1.1.1.2 > 1.1.1.1: ICMP echo reply, id 22037, seq 1108, length 64
15:24:21.273209 IP 1.1.1.2 > 1.1.1.1: ICMP echo reply, id 22037, seq 1109, length 64
15:24:22.282758 IP 1.1.1.2 > 1.1.1.1: ICMP echo reply, id 22037, seq 1110, length 64
15:24:23.294582 IP 1.1.1.2 > 1.1.1.1: ICMP echo reply, id 22037, seq 1111, length 64
```

If I match with packets other than ICMP, then output packets are shown: 

```
acunha-mbp:tmp acunha$ /usr/local/Cellar/tcpdump/4.9.2/sbin/tcpdump -r ping-lt.pcap "! icmp"
reading from file ping-lt.pcap, link-type JUNIPER_ETHER (Juniper Ethernet)
15:24:09.151184 IP 1.1.1.1 > 1.1.1.2: ICMP echo request, id 22037, seq 1097, length 64
15:24:10.161598 IP 1.1.1.1 > 1.1.1.2: ICMP echo request, id 22037, seq 1098, length 64
15:24:11.172344 IP 1.1.1.1 > 1.1.1.2: ICMP echo request, id 22037, seq 1099, length 64
15:24:12.181590 IP 1.1.1.1 > 1.1.1.2: ICMP echo request, id 22037, seq 1100, length 64
15:24:13.191704 IP 1.1.1.1 > 1.1.1.2: ICMP echo request, id 22037, seq 1101, length 64
15:24:14.201268 IP 1.1.1.1 > 1.1.1.2: ICMP echo request, id 22037, seq 1102, length 64
15:24:15.211298 IP 1.1.1.1 > 1.1.1.2: ICMP echo request, id 22037, seq 1103, length 64
15:24:16.221979 IP 1.1.1.1 > 1.1.1.2: ICMP echo request, id 22037, seq 1104, length 64
15:24:17.232381 IP 1.1.1.1 > 1.1.1.2: ICMP echo request, id 22037, seq 1105, length 64
15:24:18.241770 IP 1.1.1.1 > 1.1.1.2: ICMP echo request, id 22037, seq 1106, length 64
15:24:19.251759 IP 1.1.1.1 > 1.1.1.2: ICMP echo request, id 22037, seq 1107, length 64
15:24:20.261232 IP 1.1.1.1 > 1.1.1.2: ICMP echo request, id 22037, seq 1108, length 64
15:24:21.271556 IP 1.1.1.1 > 1.1.1.2: ICMP echo request, id 22037, seq 1109, length 64
15:24:22.281406 IP 1.1.1.1 > 1.1.1.2: ICMP echo request, id 22037, seq 1110, length 64
15:24:23.291636 IP 1.1.1.1 > 1.1.1.2: ICMP echo request, id 22037, seq 1111, length 64
```

**Comment by guyharris** [comment]
Can you read this file in Wireshark?

If so, do the input packets and output packets have a different-sized "Juniper header", such that the offset of the Ethernet header in the input and packets is different from the offset of the Ethernet header in the output packets?

If so, then this is a libpcap issue; the generated filtering code assumes a fixed-length Juniper header, which happens to be the same length as the length in the input packets, but not the same length as the length in the output packets, so the filter correctly matches input packets that are ICMP packets but doesn't correctly match output packets that are ICMP packets.

**Comment by infrastation** [comment]
Closing due to lack of feedback.
