### ISSUE TITLE
tcpdump -n 'ip and tcp port 888' can't see the protocol and response code

### ISSUE THREAD

**Issue by stevenlee87** [the-tcpdump-group/tcpdump#979]
1.
tcpdump --version
tcpdump version 5.0.0-PRE-GIT
libpcap version 1.10.1 (with TPACKET_V3)
OpenSSL 1.0.2k-fips  26 Jan 2017

cat /etc/redhat-release
CentOS Linux release 7.8.2003 (Core)

uname -r
4.19.136

tcpdump: verbose output suppressed, use -v[v]... for full protocol decode
listening on eth0, link-type EN10MB (Ethernet), snapshot length 262144 bytes
15:53:42.566898 IP 192.168.1.5.63927 > 192.168.2.7.888: Flags [S], seq 2831185618, win 65535, options [mss 1334,nop,wscale 6,nop,nop,TS val 3454779243 ecr 0,sackOK,eol], length 0
15:53:42.566950 IP 192.168.2.7.888 > 192.168.1.5.63927: Flags [S.], seq 654371063, ack 2831185619, win 65160, options [mss 1460,sackOK,TS val 2604313648 ecr 3454779243,nop,wscale 7], length 0
15:53:42.567121 IP 192.168.1.5.63926 > 192.168.2.7.888: Flags [S], seq 3487731818, win 65535, options [mss 1334,nop,wscale 6,nop,nop,TS val 2193770728 ecr 0,sackOK,eol], length 0
15:53:42.567157 IP 192.168.2.7.888 > 192.168.1.5.63926: Flags [S.], seq 1040158394, ack 3487731819, win 65160, options [mss 1460,sackOK,TS val 2604313649 ecr 2193770728,nop,wscale 7], length 0
15:53:42.590352 IP 192.168.1.5.63927 > 192.168.2.7.888: Flags [.], ack 1, win 2065, options [nop,nop,TS val 3454779267 ecr 2604313648], length 0
15:53:42.590661 IP 192.168.1.5.63926 > 192.168.2.7.888: Flags [.], ack 1, win 2065, options [nop,nop,TS val 2193770752 ecr 2604313649], length 0

I can't see the protocol and response code!!!

2.
tcpdump --version
tcpdump version 4.9.2
libpcap version 1.9.0-PRE-GIT (with TPACKET_V3)
OpenSSL 1.1.1c FIPS  28 May 2019

cat /etc/redhat-release
CentOS Linux release 8.1.1911 (Core)

uname -r
4.18.0-147.el8.x86_64

I found that it was executed on servers with centos8 kernel 4.18.0-147.el8.x86_64：

tcpdump -n 'ip and tcp port 80':

16:01:38.383094 IP 10.103.164.160.http > 10.103.164.139.34792: Flags [P.], seq 241792:242100, ack 33594, win 266, options [nop,nop,TS val 201608934 ecr 826025331], length 308: HTTP: HTTP/1.1 200 OK

I can see the protocol and the response code！（HTTP: HTTP/1.1 200 OK）

That's why ??

**Comment by infrastation** [comment]
You can run HTTP on TCP port 888, but tcpdump will not treat it as HTTP. Please see [this answer](https://www.tcpdump.org/faq.html#q12). Two main ways to print HTTP headers would be using `-A` or `-X` in tcpdump or using "follow TCP stream" in Wireshark.

**Comment by stevenlee87** [comment]
> You can run HTTP on TCP port 888, but tcpdump will not treat it as HTTP. Please see [this answer](https://www.tcpdump.org/faq.html#q12). Two main ways to print HTTP headers would be using `-A` or `-X` in tcpdump or using "follow TCP stream" in Wireshark.

thank you! Now is ok！
