### ISSUE TITLE
Could not get complete Hex code of packet in tcpdump 4.0.0

### ISSUE THREAD

**Issue by dgupta-ciena** [the-tcpdump-group/tcpdump#347]
In this tcpdump version we are trying to extract all hex code but we couldn't get any option to get this.
But the same is achieved with version 4.1.0
Check the below.
# command 

tcpdump -i remote -xx
# tcpdump 4.2.1

21:01:23.789305 IP te8500-08-act-stat.stalab.ciena.com.3197 > vm-05.stalab.ciena.com.1812: RADIUS, Access Request (1), id: 0xbb length: 109
        0x0000:  0004 0001 0006 0003 189a da01 0000 0800
        0x0010:  4500 0089 0000 4000 4011 8030 0a1a 55bf
        0x0020:  0a1a 5041 0c7d 0714 0075 baba 01bb 006d
        0x0030:  6cca 85c8 7fb0 86dd d783 d6bb f1ff b8a8
        0x0040:  0108 7374 6167 7373 0212 4cd7 5335 006f
        0x0050:  d9e6 7e19 f9e5 ceef 7a54 0406 0a1a 55c2
        0x0060:  200b 7465 3835 3030 2d30 3805 0600 0008
        0x0070:  7c3d 0600 0000 0506 0600 0000 081f 1c2f
        0x0080:  7465 6c6e 6574 5f31 302e 3236 2e38 302e
        0x0090:  3130 323a 3537 3232 30
21:01:23.790168 IP vm-05.stalab.ciena.com.1812 > te8500-08-act-stat.stalab.ciena.com.3197: RADIUS, Access Accept (2), id: 0xbb length: 35
        0x0000:  0000 0001 0006 00d0 03c3 d800 0000 0800
        0x0010:  4500 003f ff0a 0000 3f11 c26f 0a1a 5041
        0x0020:  0a1a 55bf 0714 0c7d 002b 9af3 02bb 0023
        0x0030:  3208 ecd3 981e d374 da5c d8b0 e483 0ef7
        0x0040:  0f06 0000 0000 1a09 0000 04f7 0103 34
# tcpdump 4.0.0

21:09:11.880998 IP te5410-03-rem-stat.stalab.ciena.com.9105 > vm-05.stalab.ciena.com.1812:  [|radius]
        0x0000:  00d0 03c3 d800 0003 18bb 5004 0800 4500
        0x0010:  0089 0000 4000 4011 8336 0a1a 52b9 0a1a
        0x0020:  5041 2391 0714 0075 56d4 01d3 006d 6596
        0x0030:  d841 cf12 4b01 22b5 4114
21:09:11.881514 IP vm-05.stalab.ciena.com.1812 > te5410-03-rem-stat.stalab.ciena.com.9105:  [|radius]
        0x0000:  0003 18bb 5004 00d0 03c3 d800 0800 4500
        0x0010:  003f 5732 0000 3f11 6d4e 0a1a 5041 0a1a
        0x0020:  52b9 0714 2391 002b 503f 02d3 0023 19c6
        0x0030:  8f73 7268 470e a843 8031
