### ISSUE TITLE
problem displaying timestamps for pcap-ng files on SPARC, PPC, MIPS-BE, S/390 and z/Architecture, and other big-endian platforms

### ISSUE THREAD

**Issue by irwintillman** [the-tcpdump-group/tcpdump#397]
I retrieved the tcpdump master branch at 1833 UTC June 18 2014.

Platform:
libpcap 1.5.3
Solaris 10 on SPARC
gcc 4.4.7
(also wireshark 1.10.8)

When using this version of tcpdump to read pcap-ng files
(produced by wireshark 1.10.8 using libpcap 1.5.3 on
the same platform), the timestamps displayed by 
tcpdump appear wrong.

(I don't think this is new; I think this is what I've seen on Solaris SPARC
with tcpdump 4.3.0/libpcap 1.3.0 and tcpdump 4.4.0/libpcap 1.4.0 too.)

<pre>
% /var/local/src/tcpdump-4.5.1+git-20140618-1344/tcpdump -r sample-a.pcapng -nq
reading from file sample-a.pcapng, link-type EN10MB (Ethernet)
-17:-39:-40.000 00:12:f2:13:91:20 > 00:e0:52:00:00:00, Unknown Ethertype (0x885a), length 1054: 
-13:-50:-27.000 IP 128.112.129.119 > 224.0.0.18: VRRPv2, Advertisement, vrid 1, prio 120, authtype none, intvl 1s, length 20
-21:-45:-36.000 STP 802.1w, Rapid STP, Flags [Learn, Forward], bridge-id 5080.40:55:39:0a:ad:c1.8089, length 42
-7:-42:-52.0000 ARP, Request who-has 128.112.128.240 (ff:ff:ff:ff:ff:ff) tell 128.112.128.2, length 46
-5:-18:-30.0000 IP6 fe80::225:90ff:fe38:e486 > ff02::1:ff24:46b8: ICMP6, neighbor solicitation, who has fe80::280:e5ff:fe24:46b8, length 32
-8:-55:-1.00000 IP 128.112.134.229.137 > 128.112.135.255.137: UDP, length 50
</pre>

<pre>
%  /var/local/src/tcpdump-4.5.1+git-20140618-1344/tcpdump -r sample-a.pcapng -nq -tttt
reading from file sample-a.pcapng, link-type EN10MB (Ethernet)
1945-01-27 -17:-39:-40.000 00:12:f2:13:91:20 > 00:e0:52:00:00:00, Unknown Ethertype (0x885a), length 1054: 
1945-01-30 -13:-50:-27.000 IP 128.112.129.119 > 224.0.0.18: VRRPv2, Advertisement, vrid 1, prio 120, authtype none, intvl 1s, length 20
1945-02-12 -21:-45:-36.000 STP 802.1w, Rapid STP, Flags [Learn, Forward], bridge-id 5080.40:55:39:0a:ad:c1.8089, length 42
1945-02-23 -7:-42:-52.0000 ARP, Request who-has 128.112.128.240 (ff:ff:ff:ff:ff:ff) tell 128.112.128.2, length 46
1945-04-10 -5:-18:-30.0000 IP6 fe80::225:90ff:fe38:e486 > ff02::1:ff24:46b8: ICMP6, neighbor solicitation, who has fe80::280:e5ff:fe24:46b8, length 32
1945-04-28 -8:-55:-1.00000 IP 128.112.134.229.137 > 128.112.135.255.137: UDP, length 50
</pre>

Here it is displayed by tshark 1.10.8, displaying good timestamps:

<pre>
% tshark -r sample-a.pcapng
  1 11:48:00.117348000 00:12:f2:13:91:20 -> 00:e0:52:00:00:00                              0x885a 1054 Foundry proprietary
  2 11:48:00.390301000 00:00:5e:00:01:01 -> 01:00:5e:00:00:12 0 128.112.129.119  224.0.0.18    VRRP 64 Announcement (v2)
  3 11:48:01.484992000 60:73:5c:1a:4a:34 -> 01:00:0c:cc:cc:cd 0                             STP 68 RST. Root = 20480/128/40:55:39:0a:ad:c1  Cost = 0  Port = 0x8089
  4 11:48:02.485956000 40:55:39:0a:ad:c1 -> ff:ff:ff:ff:ff:ff 0                             ARP 64 Who has 128.112.128.240?  Tell 128.112.128.2
  5 11:48:06.469018000 00:25:90:38:e4:86 -> 33:33:ff:24:46:b8  fe80::225:90ff:fe38:e486  ff02::1:ff24:46b8  ICMPv6 86 Neighbor Solicitation for fe80::280:e5ff:fe24:46b8 from 00:25:90:38:e4:86
  6 11:48:08.011227000 00:50:56:93:00:bb -> ff:ff:ff:ff:ff:ff  128.112.134.229 137 128.112.135.255 137 NBNS 92 Name query NB WPAD
</pre>

If I used wireshark 1.10.8 to convert the file from pcap-ng to pcap, 
tcpdump can now display the timestamps:

<pre>
% editcap -F pcap sample-a.pcapng  sample-a.pcap 
% /var/local/src/tcpdump-4.5.1+git-20140618-1344/tcpdump -r sample-a.pcap -nq
reading from file sample-a.pcap, link-type EN10MB (Ethernet)
11:48:00.117348 00:12:f2:13:91:20 > 00:e0:52:00:00:00, Unknown Ethertype (0x885a), length 1054: 
11:48:00.390301 IP 128.112.129.119 > 224.0.0.18: VRRPv2, Advertisement, vrid 1, prio 120, authtype none, intvl 1s, length 20
11:48:01.484992 STP 802.1w, Rapid STP, Flags [Learn, Forward], bridge-id 5080.40:55:39:0a:ad:c1.8089, length 42
11:48:02.485956 ARP, Request who-has 128.112.128.240 (ff:ff:ff:ff:ff:ff) tell 128.112.128.2, length 46
11:48:06.469018 IP6 fe80::225:90ff:fe38:e486 > ff02::1:ff24:46b8: ICMP6, neighbor solicitation, who has fe80::280:e5ff:fe24:46b8, length 32
11:48:08.011227 IP 128.112.134.229.137 > 128.112.135.255.137: UDP, length 50
</pre>

<pre>
% /var/local/src/tcpdump-4.5.1+git-20140618-1344/tcpdump -r sample-a.pcap -nq -tttt
reading from file sample-a.pcap, link-type EN10MB (Ethernet)
2014-07-02 11:48:00.117348 00:12:f2:13:91:20 > 00:e0:52:00:00:00, Unknown Ethertype (0x885a), length 1054: 
2014-07-02 11:48:00.390301 IP 128.112.129.119 > 224.0.0.18: VRRPv2, Advertisement, vrid 1, prio 120, authtype none, intvl 1s, length 20
2014-07-02 11:48:01.484992 STP 802.1w, Rapid STP, Flags [Learn, Forward], bridge-id 5080.40:55:39:0a:ad:c1.8089, length 42
2014-07-02 11:48:02.485956 ARP, Request who-has 128.112.128.240 (ff:ff:ff:ff:ff:ff) tell 128.112.128.2, length 46
2014-07-02 11:48:06.469018 IP6 fe80::225:90ff:fe38:e486 > ff02::1:ff24:46b8: ICMP6, neighbor solicitation, who has fe80::280:e5ff:fe24:46b8, length 32
2014-07-02 11:48:08.011227 IP 128.112.134.229.137 > 128.112.135.255.137: UDP, length 50
</pre>

Here is the capture file:

<pre>
begin-base64 600 sample-a.pcap
obLD1AACAAQAAAAAAAAAAAAA//8AAAABU7QpsAABymQAAAQeAAAEHgDgUgAAAAAS8hOR
IIhaAQIEHgIAAMAAAQAS8hORALjUAAAAACpxYcQgjKs4IN6FzCCMq1AgXr08AAAABSpx
YcQgjKygIN6FzCCMq5ggXt5YIIyraCBdNEQAAAAoILe+xCCMq3AqcWHEIIyr4CCMrAwA
AAAAIhEhHiCMq9gqcWHEIR/NPCpxYcQAAAA/AAAAACCMq9ggXr6cIIyuyAAAAAAiENEe
IIysXCCMq/ggXb60IIyr+CIQ0QAgjKvgKnFhxCEfzTwj6tyoAAAAPypxYcQgjKxIIF5M
aIBwhLeAcIOGAAAAAAAAAAAAAAAAAAAAACCMrFAAAAAAIJjRRAAAAAAiD6T0AAAMIQAA
AEAACr4UI9fb4CCYwgwAAAAAAAAAACCY0UQiD6T0IIytagAADCEgjKzoAAH3QQAAAP8A
AAwhIIytYCAtEeAMIa2ogAAAAAAAAAAAAAADAAAAAAAAAAAQAAAAAAAAQSCYwgwAAAEE
ABLyEwPuUAAAAAAAAAAAACCMrKAAAAADID2i/CIQ0QAAAAAEAAAAYCCMrLAgCPt8AVAA
AANRKAAgjKzIIAkGUABAz4EAAABiIJjRRCIQ0QAgjKzoIAkAwAAAAEAiENEAAAAAYiIP
pPQBAAAAAAAAACCMrTAgX3JgIIyuSABAwAEAEAABB8AAAIBwgHIgtPXQAAAAAAAAAAAg
mNFE4AAAAAAAAFQgt77EKorxQCIQ0R6AcIByIIytvCCMrWggXXsIAAAAAwAAAAEAQAAB
gHCAciIQSR4AAABAIhDRMiCMrsgAAABUAAAAACIQ0R4gjK28IIytsCBdvrQgjK2QIF1c
dCCMrYAAAAABAAAAAAAAAAAgjK7IIIytvCCMrZggXVuwIIytsCBdyWAAAABUIhBJMiIQ
0R4gt77EIIyuQCBdSKwgjK8QgHCEVlxsK3cAAAAAAAEAAAAAAAAAAAAAAAAAAAAAAAAA
AAAAAAAAAAAAAAAAAAAAAAAAAAAAAAAAAAD//4BwgHIAAAAAAAAAAAAAAACMrmDgAAAA
AAD//wAAAEAgmMIMAAABACqKi0gAAABAIIyuvCCMrsggjK5IIhBJHiCMrnAiEEkAAAAA
AwAAAEAgjK5YIAj7fAFQAAADZegAIIyucCAJBlAAT8+PAAAAPCCY0UQiEEkAIIyukCAJ
AMAAAAAUAAAAAABPwf8BAAAAIhBJACIQSRAgjK7YIEjs7AAAAEAAAAAAEAAAACAAAQQi
NOVxIJjRRAAAAAAAAAAAIhBJECCYwgwAAAAKAAAPoCCY0UQAAABPIhBJAAAAAAEgjK8Q
IDWjbAAAAAAAAA+gIIyvMABFpvsgAAAAAAAAABAAAAAgAAEEIjTlcSCY0UQARacZAEWm
+wCAAgAACvh7AAD//wAK+MsCKgABILVTtCmwAAX0nQAAAEAAAABAAQBeAAASAABeAAEB
gQDAAAgARQAAKFMbAAD/cIZQgHCBd+AAABIhAXgBAAFhpIBwhOcAAAAAAAAAAAAAAAAA
AFO0KbEAB2aAAAAARAAAAEQBAAzMzM1gc1waSjSBAMAAADKqqgMAAAwBCwAAAgI8UIBA
VTkKrcEAAAAAUIBAVTkKrcGAiQAAFAACAA8AAAAAAAIAgFO0KbIAB2pEAAAAQAAAAED/
//////9AVTkKrcGBAKAACAYAAQgABgQAAUBVOQqtwYBwgAL///////+AcIDwAAAAAAAA
AAAAAAAAAAAAAAAAU7QptgAHKBoAAABWAAAAVjMz/yRGuAAlkDjkhobdYAAAAAAgOv/+
gAAAAAAAAAIlkP/+OOSG/wIAAAAAAAAAAAAB/yRGuIcAHZsAAAAA/oAAAAAAAAACgOX/
/iRGuAEBACWQOOSGU7QpuAAAK9sAAABcAAAAXP///////wBQVpMAuwgARQAATluAAACA
Ec9ZgHCG5YBwh/8AiQCJADoBBawvARAAAQAAAAAAACBGSEZBRUJFRUNBQ0FDQUNBQ0FD
QUNBQ0FDQUNBQ0FBQQAAIAAB
====
</pre>
