### ISSUE TITLE
tcpdump outputs incorrect TCP flags for null packets

### ISSUE THREAD

**Issue by TheBalanceOfEvidence** [the-tcpdump-group/tcpdump#391]
tcpdump displays incorrect TCP flags in the case of null packets when using default options, but shows the correct flags when using the verbose flag:

tcpdump -r interface.cap -n host 192.168.0.10

08:36:43.100723 IP 64.164.127.51.52846 > 192.168.0.10.80: Flags [S.], seq 0:188, win 8192, length 188
08:36:43.100729 IP 208.117.49.71.52859 > 192.168.0.10.80: Flags [S.], seq 0:155, win 8192, length 155
08:36:43.100735 IP 208.235.250.48.30021 > 192.168.0.10.80: Flags [S.], seq 0:175, win 8192, length 175
08:36:43.100741 IP 208.179.155.38.43016 > 192.168.0.10.80: Flags [S.], seq 0:175, win 8192, length 175
08:36:43.100749 IP 4.234.170.196.54446 > 192.168.0.10.80: Flags [S.], seq 0:185, win 8192, length 185
08:36:43.100756 IP 209.66.129.14.63630 > 192.168.0.10.80: Flags [S.], seq 0:169, win 8192, length 169
08:36:43.100761 IP 209.51.107.72.9325 > 192.168.0.10.80: Flags [S.], seq 0:160, win 8192, length 160

tcpdump -r interface.cap -nv host 192.168.0.10

08:36:43.100723 IP (tos 0x0, ttl 216, id 1, offset 0, flags [none], proto TCP (6), length 228)
    64.164.127.51.52846 > 192.168.0.10.80: Flags [none], cksum 0x6ea0 (correct), seq 0:188, win 8192, length 188
08:36:43.100729 IP (tos 0x0, ttl 244, id 1, offset 0, flags [none], proto TCP (6), length 195)
    208.117.49.71.52859 > 192.168.0.10.80: Flags [none], cksum 0x2ccf (correct), seq 0:155, win 8192, length 155
08:36:43.100735 IP (tos 0x0, ttl 241, id 1, offset 0, flags [none], proto TCP (6), length 215)
    208.235.250.48.30021 > 192.168.0.10.80: Flags [none], cksum 0xbc91 (correct), seq 0:175, win 8192, length 175
08:36:43.100741 IP (tos 0x0, ttl 224, id 1, offset 0, flags [none], proto TCP (6), length 215)
    208.179.155.38.43016 > 192.168.0.10.80: Flags [none], cksum 0xe910 (correct), seq 0:175, win 8192, length 175
08:36:43.100749 IP (tos 0x0, ttl 198, id 1, offset 0, flags [none], proto TCP (6), length 225)
    4.234.170.196.54446 > 192.168.0.10.80: Flags [none], cksum 0x788c (correct), seq 0:185, win 8192, length 185
08:36:43.100756 IP (tos 0x0, ttl 241, id 1, offset 0, flags [none], proto TCP (6), length 209)
    209.66.129.14.63630 > 192.168.0.10.80: Flags [none], cksum 0xb219 (correct), seq 0:169, win 8192, length 169
08:36:43.100761 IP (tos 0x0, ttl 232, id 1, offset 0, flags [none], proto TCP (6), length 200)
    209.51.107.72.9325 > 192.168.0.10.80: Flags [none], cksum 0x9c19 (correct), seq 0:160, win 8192, length 160
